{
  "schema_version": "extraction_bundle.v1",
  "notice_id": "352508",
  "extractor_version": "rule-extract-0.1.0",
  "records": [
    {
      "record_key": "352508-01",
      "cohort": null,
      "grade": null,
      "education": null,
      "college": "教育学院",
      "major": "教育学",
      "city": null,
      "position_or_unit": "公务员情形的",
      "review_status": "review_required",
      "confidence": 0.0,
      "evidence": [
        {
          "field": "education",
          "text": "，其中，可同时面向15所浙江省内重点建设本科院校的市直机关选调计划45名（见附件3）",
          "method": "html_rule",
          "asset_id": null,
          "bbox": null
        },
        {
          "field": "education",
          "text": "周岁（1999年10月10日以后出生），硕士研究生不超过28周岁（1996年10月1",
          "method": "html_rule",
          "asset_id": null,
          "bbox": null
        },
        {
          "field": "education",
          "text": "周岁（1996年10月10日以后出生），博士研究生不超过30周岁（1994年10月1",
          "method": "html_rule",
          "asset_id": null,
          "bbox": null
        },
        {
          "field": "college",
          "text": "培养、委托培养、在职培养和网络学院、成人教育学院、独立学院的应届毕业生，按全日制教育方式",
          "method": "html_rule",
          "asset_id": null,
          "bbox": null
        },
        {
          "field": "major",
          "text": "培养、委托培养、在职培养和网络学院、成人教育学院、独立学院的应届毕业生，按全日制教育方",
          "method": "html_rule",
          "asset_id": null,
          "bbox": null
        },
        {
          "field": "city",
          "text": "七十四条所列情形的职位。本次选调笔试，在北京、成都、深圳以及杭州、宁波、温州、金华设",
          "method": "html_rule",
          "asset_id": null,
          "bbox": null
        },
        {
          "field": "city",
          "text": "条所列情形的职位。本次选调笔试，在北京、成都、深圳以及杭州、宁波、温州、金华设笔试考",
          "method": "html_rule",
          "asset_id": null,
          "bbox": null
        },
        {
          "field": "city",
          "text": "情形的职位。本次选调笔试，在北京、成都、深圳以及杭州、宁波、温州、金华设笔试考区。考",
          "method": "html_rule",
          "asset_id": null,
          "bbox": null
        },
        {
          "field": "city",
          "text": "位。本次选调笔试，在北京、成都、深圳以及杭州、宁波、温州、金华设笔试考区。考生网上报",
          "method": "html_rule",
          "asset_id": null,
          "bbox": null
        },
        {
          "field": "position_or_unit",
          "text": "其他有关法律法规、规章政策明确不得录用为公务员情形的，不得报考。三、选调程序（一）学校推荐。",
          "method": "html_rule",
          "asset_id": null,
          "bbox": null
        }
      ]
    }
  ],
  "processing_status": "review_required",
  "failure_reason": null,
  "processed_at": "2026-09-19T21:04:25+08:00"
}