{
  "schema_version": "extraction_bundle.v1",
  "notice_id": "247919",
  "extractor_version": "rule-extract-0.1.0",
  "records": [
    {
      "record_key": "247919-01",
      "cohort": "2024届",
      "grade": "2020",
      "education": "本科",
      "college": null,
      "major": "行政管理",
      "city": "保定",
      "position_or_unit": "保定市徐水区财政局",
      "review_status": "review_required",
      "confidence": 0.85,
      "evidence": [
        {
          "field": "cohort",
          "text": "2024届河北定向选调生",
          "method": "ocr_rule",
          "asset_id": "247919-poster-01",
          "bbox": [
            510.0,
            988.0,
            1065.0,
            1052.0
          ]
        },
        {
          "field": "grade",
          "text": "管理学院2020级行政管理专业本",
          "method": "ocr_rule",
          "asset_id": "247919-poster-01",
          "bbox": [
            515.0,
            1053.0,
            1284.0,
            1122.0
          ]
        },
        {
          "field": "education",
          "text": "2024届河北定向选调生管理学院2020级行政管理专业本科生保定市徐水区财政局试用期公务员（不定职级）",
          "method": "ocr_rule",
          "asset_id": "247919-poster-01",
          "bbox": [
            510.0,
            988.0,
            1284.0,
            1323.0
          ]
        },
        {
          "field": "college",
          "text": "2024届河北定向选调生管理学院2020级行政管理专业本科生保定市徐水区财政局试用期公务员（不定职级）",
          "method": "ocr_rule",
          "asset_id": "247919-poster-01",
          "bbox": [
            510.0,
            988.0,
            1284.0,
            1323.0
          ]
        },
        {
          "field": "major",
          "text": "管理学院2020级行政管理专业本",
          "method": "ocr_rule",
          "asset_id": "247919-poster-01",
          "bbox": [
            515.0,
            1053.0,
            1284.0,
            1122.0
          ]
        },
        {
          "field": "city",
          "text": "保定市徐水区财政局",
          "method": "ocr_rule",
          "asset_id": "247919-poster-01",
          "bbox": [
            515.0,
            1193.0,
            995.0,
            1256.0
          ]
        },
        {
          "field": "position_or_unit",
          "text": "保定市徐水区财政局",
          "method": "ocr_rule",
          "asset_id": "247919-poster-01",
          "bbox": [
            515.0,
            1193.0,
            995.0,
            1256.0
          ]
        }
      ]
    },
    {
      "record_key": "247919-02",
      "cohort": "2024届",
      "grade": "2021",
      "education": "硕士",
      "college": "文学院",
      "major": "汉语言文字学",
      "city": "唐山",
      "position_or_unit": "唐山市纪委监委",
      "review_status": "processed",
      "confidence": 0.76,
      "evidence": [
        {
          "field": "cohort",
          "text": "2024届河北定向选调生",
          "method": "ocr_rule",
          "asset_id": "247919-poster-01",
          "bbox": [
            522.0,
            1695.0,
            1071.0,
            1743.0
          ]
        },
        {
          "field": "grade",
          "text": "文学院2021级汉语言文字学专业",
          "method": "ocr_rule",
          "asset_id": "247919-poster-01",
          "bbox": [
            520.0,
            1759.0,
            1284.0,
            1814.0
          ]
        },
        {
          "field": "education",
          "text": "米硕士研究生",
          "method": "ocr_rule",
          "asset_id": "247919-poster-01",
          "bbox": [
            0.0,
            1786.0,
            788.0,
            1954.0
          ]
        },
        {
          "field": "college",
          "text": "文学院2021级汉语言文字学专业",
          "method": "ocr_rule",
          "asset_id": "247919-poster-01",
          "bbox": [
            520.0,
            1759.0,
            1284.0,
            1814.0
          ]
        },
        {
          "field": "major",
          "text": "文学院2021级汉语言文字学专业",
          "method": "ocr_rule",
          "asset_id": "247919-poster-01",
          "bbox": [
            520.0,
            1759.0,
            1284.0,
            1814.0
          ]
        },
        {
          "field": "city",
          "text": "唐山市纪委监委",
          "method": "ocr_rule",
          "asset_id": "247919-poster-01",
          "bbox": [
            524.0,
            1898.0,
            892.0,
            1946.0
          ]
        },
        {
          "field": "position_or_unit",
          "text": "唐山市纪委监委",
          "method": "ocr_rule",
          "asset_id": "247919-poster-01",
          "bbox": [
            524.0,
            1898.0,
            892.0,
            1946.0
          ]
        }
      ]
    }
  ],
  "processing_status": "review_required",
  "failure_reason": null,
  "processed_at": "2026-09-22T14:48:01+08:00"
}